{
  "tako": {
    "profileVersion": 1
  },
  "profileName": "domo_demo_midi",
  "renderer": "midi.smf",
  "output": {
    "path": "out/demo.mid"
  },
  "bindings": [
    {
      "selector": { "sound": "pad" },
      "config": { "ch": 1, "program": 48 }
    },
    {
      "selector": { "sound": "keys" },
      "config": { "ch": 2, "program": 0 }
    },
    {
      "selector": { "sound": "guitar" },
      "config": { "ch": 3, "program": 27 }
    },
    {
      "selector": { "sound": "bass" },
      "config": { "ch": 4, "program": 33 }
    },
    {
      "selector": { "sound": "lead_vocal" },
      "config": { "ch": 5, "program": 81 }
    },
    {
      "selector": { "sound": "kit_standard" },
      "config": {
        "ch": 10,
        "drumMap": {
          "kick": 36,
          "snare": 38,
          "hhc": 42,
          "hho": 46,
          "crash": 49,
          "ride": 51,
          "tom1": 50,
          "tom2": 47,
          "tom3": 45,
          "clap": 39,
          "perc1": 82
        }
      }
    }
  ]
}
